{
  "$schema": "./schemas/course-contract.schema.json",
  "schemaVersion": 1,
  "courseId": "auth-authz",
  "title": "情シスのための認証認可入門",
  "source": {
    "path": "articles/series/authn-authz/curriculum.json",
    "schemaVersion": 2,
    "sha256": "b7ef415fd102f8c3f7327899cb09e27f7ced8fba2fae76ff25f73c1ed06f61a2",
    "revision": null
  },
  "courseOutcomes": [
    {
      "id": "AA-CO1",
      "statement": "HTTPの往復を見て、認証、セッション、認可、フェデレーション、委任認可の失敗箇所を分類する"
    },
    {
      "id": "AA-CO2",
      "statement": "credential、cookie、ticket、assertion、tokenについて、発行者、運搬者、検証者、寿命を追跡する"
    },
    {
      "id": "AA-CO3",
      "statement": "正常系と拒否系を再現し、HTTP応答とログから結果を説明する"
    },
    {
      "id": "AA-CO4",
      "statement": "受け手に必要な署名、issuer、audience、期限、nonce、state、PKCE、scope、resource認可を特定する"
    },
    {
      "id": "AA-CO5",
      "statement": "典型的な認証認可の失敗を診断し、修正案を選ぶ"
    },
    {
      "id": "AA-CO6",
      "statement": "MFA、WebAuthn、Passkeyを登録、復旧、失効、利用者体験まで含めて評価する"
    },
    {
      "id": "AA-CO7",
      "statement": "企業のID基盤とSaaS/API連携を最小権限、ライフサイクル、監査、例外管理の観点でレビューする"
    }
  ],
  "lessons": [
    {
      "id": "setup",
      "kind": "course-setup",
      "module": "orientation",
      "articleSlug": null,
      "environmentRef": "curriculum/support-matrix.json#lessons.setup",
      "learningPrerequisites": [],
      "estimatedMinutes": 60,
      "extensionMinutes": 0,
      "extensionTaskRef": null,
      "readingAssessmentRef": null,
      "objectives": [
        {
          "id": "AA-SETUP-O1",
          "courseOutcomeIds": [],
          "statement": "自分の環境が選択した学習経路の要件を満たすか診断する"
        },
        {
          "id": "AA-SETUP-O2",
          "courseOutcomeIds": [],
          "statement": "教材を起動、確認、停止、初期化し、診断結果を読める"
        }
      ],
      "assessments": [
        {
          "id": "AA-SETUP-A1",
          "artifactStatus": "implemented",
          "objectiveIds": [
            "AA-SETUP-O1",
            "AA-SETUP-O2"
          ],
          "type": "automated",
          "artifactSetRef": "course/lessons/setup/assessment.yaml#AA-SETUP-A1",
          "requiredCheckIds": [
            "AA-SETUP-C1",
            "AA-SETUP-C2",
            "AA-SETUP-C3"
          ],
          "evidence": "checkが保存するdoctor・setup・reset後の再診断結果と、terminal purgeが返す残存resource 0件のJSON結果",
          "passCriteria": "checkが全required checkをpassとしてevidence IDを返し、続くpurgeがpassかつ教材所有resource 0件を返す"
        }
      ],
      "requiredChecks": [
        {
          "id": "AA-SETUP-C1",
          "mode": "lab",
          "assessmentId": "AA-SETUP-A1",
          "objectiveIds": [
            "AA-SETUP-O1",
            "AA-SETUP-O2"
          ],
          "courseOutcomeIds": [],
          "evidenceType": "automated",
          "required": true,
          "mappingBasis": "assessment-objective-closure"
        },
        {
          "id": "AA-SETUP-C2",
          "mode": "lab",
          "assessmentId": "AA-SETUP-A1",
          "objectiveIds": [
            "AA-SETUP-O1",
            "AA-SETUP-O2"
          ],
          "courseOutcomeIds": [],
          "evidenceType": "automated",
          "required": true,
          "mappingBasis": "assessment-objective-closure"
        },
        {
          "id": "AA-SETUP-C3",
          "mode": "lab",
          "assessmentId": "AA-SETUP-A1",
          "objectiveIds": [
            "AA-SETUP-O1",
            "AA-SETUP-O2"
          ],
          "courseOutcomeIds": [],
          "evidenceType": "automated",
          "required": true,
          "mappingBasis": "assessment-objective-closure"
        }
      ]
    },
    {
      "id": "01",
      "kind": "article-lesson",
      "module": "web-foundations",
      "articleSlug": "authn-authz-01-login-basics",
      "environmentRef": "curriculum/support-matrix.json#lessons.01",
      "learningPrerequisites": [],
      "estimatedMinutes": 75,
      "extensionMinutes": 0,
      "extensionTaskRef": null,
      "readingAssessmentRef": "episodes/01-authn-authz-01-login-basics/assessment.yaml#AA01-A1",
      "objectives": [
        {
          "id": "AA01-O1",
          "courseOutcomeIds": [
            "AA-CO1",
            "AA-CO2"
          ],
          "statement": "request trace内の各stepと失敗箇所を、認証、セッション、認可、フェデレーション、委任認可へ分類する"
        },
        {
          "id": "AA01-O2",
          "courseOutcomeIds": [
            "AA-CO1",
            "AA-CO5"
          ],
          "statement": "失敗した責任と確認すべき担当コンポーネントを特定する"
        }
      ],
      "assessments": [
        {
          "id": "AA01-A1",
          "artifactStatus": "implemented",
          "objectiveIds": [
            "AA01-O1",
            "AA01-O2"
          ],
          "type": "provided-case-scenario",
          "artifactSetRef": "course/lessons/01/assessment.yaml#AA01-A1",
          "requiredCheckIds": [
            "AA01-C1",
            "AA01-C2"
          ],
          "evidence": "実プロトコルの実行証跡ではないprovided case 10件の分類結果と、5つの責任境界に対応する検証者",
          "passCriteria": "10事例中9件以上を正しく分類し、5つの責任境界と検証者を記載する"
        }
      ],
      "requiredChecks": [
        {
          "id": "AA01-C1",
          "mode": "lab",
          "assessmentId": "AA01-A1",
          "objectiveIds": [
            "AA01-O1",
            "AA01-O2"
          ],
          "courseOutcomeIds": [
            "AA-CO1",
            "AA-CO2",
            "AA-CO5"
          ],
          "evidenceType": "provided-case-scenario",
          "required": true,
          "mappingBasis": "assessment-objective-closure"
        },
        {
          "id": "AA01-C2",
          "mode": "lab",
          "assessmentId": "AA01-A1",
          "objectiveIds": [
            "AA01-O1",
            "AA01-O2"
          ],
          "courseOutcomeIds": [
            "AA-CO1",
            "AA-CO2",
            "AA-CO5"
          ],
          "evidenceType": "provided-case-scenario",
          "required": true,
          "mappingBasis": "assessment-objective-closure"
        }
      ]
    },
    {
      "id": "02",
      "kind": "article-lesson",
      "module": "web-foundations",
      "articleSlug": "authn-authz-02-password-authentication",
      "environmentRef": "curriculum/support-matrix.json#lessons.02",
      "learningPrerequisites": [
        "01"
      ],
      "estimatedMinutes": 90,
      "extensionMinutes": 45,
      "extensionTaskRef": "course/lessons/02/extension.yaml",
      "readingAssessmentRef": "episodes/02-authn-authz-02-password-authentication/assessment.yaml#AA02-A1",
      "objectives": [
        {
          "id": "AA02-O1",
          "courseOutcomeIds": [
            "AA-CO2",
            "AA-CO3"
          ],
          "statement": "パスワード登録と照合の処理を追跡する"
        },
        {
          "id": "AA02-O2",
          "courseOutcomeIds": [
            "AA-CO2",
            "AA-CO5"
          ],
          "statement": "平文、hash、salt、rate limitの役割を評価する"
        }
      ],
      "assessments": [
        {
          "id": "AA02-A1",
          "artifactStatus": "implemented",
          "objectiveIds": [
            "AA02-O1",
            "AA02-O2"
          ],
          "type": "automated-and-explanation",
          "artifactSetRef": "course/lessons/02/assessment.yaml#AA02-A1",
          "requiredCheckIds": [
            "AA02-C1",
            "AA02-C2",
            "AA02-C3"
          ],
          "evidence": "loopback上の実HTTPで毎回新規scenarioを実行し、password保存表現、成功200、generic 422、3回目の429とRetry-After、30秒後の復旧を秘匿済みruntime evidenceと短答で確認する",
          "passCriteria": "checkが保存済みruntimeを信用せずfresh scenarioを再実行し、平文非保存、同一passwordのsalt差、session未発行、誤passwordと未知identifierの同一422、3回目の429、per-identifier制限とglobal KDF容量保護が未実装である境界を、AA02-C1からAA02-C3の全件で確認する"
        }
      ],
      "requiredChecks": [
        {
          "id": "AA02-C1",
          "mode": "lab",
          "assessmentId": "AA02-A1",
          "objectiveIds": [
            "AA02-O1",
            "AA02-O2"
          ],
          "courseOutcomeIds": [
            "AA-CO2",
            "AA-CO3",
            "AA-CO5"
          ],
          "evidenceType": "automated-and-explanation",
          "required": true,
          "mappingBasis": "assessment-objective-closure"
        },
        {
          "id": "AA02-C2",
          "mode": "lab",
          "assessmentId": "AA02-A1",
          "objectiveIds": [
            "AA02-O1",
            "AA02-O2"
          ],
          "courseOutcomeIds": [
            "AA-CO2",
            "AA-CO3",
            "AA-CO5"
          ],
          "evidenceType": "automated-and-explanation",
          "required": true,
          "mappingBasis": "assessment-objective-closure"
        },
        {
          "id": "AA02-C3",
          "mode": "lab",
          "assessmentId": "AA02-A1",
          "objectiveIds": [
            "AA02-O1",
            "AA02-O2"
          ],
          "courseOutcomeIds": [
            "AA-CO2",
            "AA-CO3",
            "AA-CO5"
          ],
          "evidenceType": "automated-and-explanation",
          "required": true,
          "mappingBasis": "assessment-objective-closure"
        }
      ]
    },
    {
      "id": "03",
      "kind": "article-lesson",
      "module": "web-foundations",
      "articleSlug": "authn-authz-03-session-management",
      "environmentRef": "curriculum/support-matrix.json#lessons.03",
      "learningPrerequisites": [
        "02"
      ],
      "estimatedMinutes": 105,
      "extensionMinutes": 45,
      "extensionTaskRef": "course/lessons/03/extension.yaml",
      "readingAssessmentRef": "episodes/03-authn-authz-03-session-management/assessment.yaml#AA03-A1",
      "objectives": [
        {
          "id": "AA03-O1",
          "courseOutcomeIds": [
            "AA-CO2"
          ],
          "statement": "Cookie、Session ID、Session Storeを区別して追跡する"
        },
        {
          "id": "AA03-O2",
          "courseOutcomeIds": [
            "AA-CO3",
            "AA-CO5"
          ],
          "statement": "認証時のSession ID更新と、logout、期限切れ、server失効後の拒否を確認する"
        }
      ],
      "assessments": [
        {
          "id": "AA03-A1",